Uuid,Void/Retire,Name,Description,Java class name,Parent,Concept Classes
882f8caa-683e-4d01-8f45-90f6e9b169aa,,ChemTest Order,An order for a Chemistry test,org.openmrs.Order,,ChemTest;ChemSet
1aa8272b-04ce-42c0-9638-66950cea5558,,HemaTest Order,An order for Hematology test,org.openmrs.Order,,HemaTest;HemaSet
dece34dd-ccbf-4012-af76-06b479e13d48,,MicroTest Order,An order for Microbiology test,org.openmrs.Order,,MicroTest;MicroSet
16bb6bcf-2e81-4ba5-8583-ff4913201a72,,Drug Order,An order for a medication to be given to the patient,org.openmrs.DrugOrder,,Drug
f8ae333e-9d1a-423e-a6a8-c3a0687ebcf2,,Lab Order,An order for laboratory tests,org.openmrs.Order,,LabTest;LabSet